name,product_id,price
Jam Tangan Timex M79 Automatic 40mm Black dial & Blue Top Ring,2200970809,Rp 2.114.550
Jam Tangan Wanita Abstract Florals Midi Rose Gold OB16VM11,523020833,Rp 2.250.000
Jam Tangan Pria Q Timex Diver inspired SST Case Black Dial SST Band,1206331287,Rp 1.664.550
Jam Tangan Olivia Burton Fine Art Midi Dial Black & Rose Gold OB16WG68,609539339,Rp 1.550.000
Daniel Wellington Classic Petite Melrose 28mm - 04.CPMW28.0001,2051725874,Rp 2.700.000
Jam Tangan Q Timex Reissue 38mm Stainless Steel Bracelet TW2U61800,2746776977,Rp 1.849.500
Jam Tangan Olivia Burton Watercolour Florals Midi Rose Gold OB16PP39,590763185,Rp 2.250.000
Jam Tangan Timex M79 Automatic 40mm Stainless Steel TW2U83400,2757471249,Rp 2.114.550
Daniel Wellington Quadro 20X26 Pressed Melrose RG White - DW00100431,2028449474,Rp 3.270.000
Jam Tangan Pria Timex X Footurama - TWLB33100,707866090,Rp 1.139.400
Jam Tangan Pria Timex Digital Marathon TW5K94600 Original,563832030,Rp 599.400
Jam Tangan Olivia Burton Mini White MOP Dial Sparkle Markers OB16MN05,2348772131,Rp 2.475.000
Jam Tangan Pria Q Timex Diver inspired SST Case White Dial SST Band,1206371430,Rp 1.664.550
Daniel Wellington Classic Petite Melrose Black 28mm,1030349313,Rp 2.700.000
Jam Tangan Timex Q Diver Inspired SST Case Blue Dial SST TW2U61100,1681902565,Rp 1.664.550
Jam Tangan Timex M79 Automatic 40mm Stainless Steel TW2U78300,1402960640,Rp 2.114.550
Jam Tangan Olivia Burton White Dial Rose Gold Mesh OB16MDW01,421043762,Rp 2.250.000
Jam Tangan Timex Q Diver Inspired SST Case Black Dial Band TW2U61300,2192339124,Rp 1.849.500
Jam Tangan Olivia Burton Terrazzo Florals Demi Dial Eco Light Grey,590832669,Rp 1.631.250
Daniel Wellington Quadro 20X26 Pressed Sheffield RG White - DW00100434,2028513772,Rp 2.850.000
Jam Tangan Olivia Burton Celestial Demi Rose Gold Boucle OB16GD33,590792467,Rp 1.743.750
Jam Tangan Timex Essex Ave Thin 40mm Silvertone Case Blue Dial SST,5389378329,Rp 1.199.400
Daniel Wellington Quadro 20x26 Pressed Sheffield Black - DW00100435,2028525901,Rp 2.850.000
Jam Tangan Olivia Burton Bejewelled White Midi Dial Rose Gold OB16BJ02,609525761,Rp 2.875.000
Jam Tangan Timex Waterbury Classic Chrono 40mm SST Case Navy TW2U04700,6709169339,Rp 1.559.400
Jam Tangan Pria Timex The Waterbury Chronograph Tw2P84300,617324718,Rp 1.889.300
Jam Tangan Olivia Burton Glitter Dial 3D Bee Pale & RG OB16GD46,590668292,Rp 3.230.000
Jam Tangan Olivia Burton Meant To Bee Mini Blush MOP Rose Gold Boucle,2698613513,Rp 2.775.000
Daniel Wellington Classic Petite St. Mawes Black Rose Gold 28mm,2174711725,Rp 2.560.000
Daniel Wellington Petite 24 Pressed Melrose Rose Gold White DW00100447,2028651139,Rp 2.850.000
Daniel Wellington Quadro 20X26 Pressed Melrose RG Black - DW00100432,2028455962,Rp 3.270.000
Jam Tangan Olivia Burton Mini Blush 3D Bee Rose Gold Bracelet OB16MC5,596071083,Rp 3.700.000
Daniel Wellington Petite Unitone 32 RG Rose Gold DW00100471,2491517643,Rp 3.420.000
Daniel Wellington Iconic Motion (10 ATM) 40 Rose Gold Black DW00100425,2030632751,Rp 4.280.000
Daniel Wellington Petite 24 Sheffield Rose Gold Black - DW00100444,2028628082,Rp 2.560.000
Jam Tangan Timex x Orbit Gear - TWLB32100,4584707631,Rp 1.612.800
Jam Tangan Timex Q Diver Inspired Black Case Black Dial TW2U61600,3322913454,Rp 1.664.550
Jam Tangan Wanita Olivia Burton Lucky Bee Demi Grey Dial OB16FB10,753375146,Rp 3.700.000
Jam Tangan Wanita Celestial Matte Black Boucle Mesh & Silver OB16GD16,609528366,Rp 2.250.000
Daniel Wellington Petite 24 Sheffield RG White - DW00100443,2028606871,Rp 2.560.000
Jam Tangan Timex DGTL 45mm Black Resin Strap TW5M41400,4762929291,Rp 449.550
Jam Tangan Olivia Burton The England Demi Pale Gold OB16EN13,3598427409,Rp 2.175.000
Jam Tangan Olivia Burton Sparkle Butterfly Midi Blush MOP Butterflies,2698828953,Rp 2.475.000
Jam Tangan Olivia Burton Celestial Black MOP Dial OB16GD80,2348719086,Rp 2.103.750
Jam Tangan Daniel Wellington Quadro 20X26 Pressed Ashfield RG Black,2028460882,Rp 3.270.000
Daniel Wellington Classic Petite Melrose 32mm - 04.CPMW.0001,2047300663,Rp 3.130.000
Jam Tangan Wanita Midi White Glitter Dial Rose Gold Boucle Mesh,1516485990,Rp 1.976.250
Jam Tangan Wanita Sparkle Florals Demi Mother of Pearl&Rose Gold Mesh,1213615525,Rp 2.475.000
Jam Tangan Waterbury Traditional Day Date 39mm SST Blue Dial TW2U90400,3322981914,Rp 1.349.500
Jam Tangan Timex Waterbury Traditional Chronograph 42mm TW2U90700,2757493224,Rp 1.599.500
Jam Tangan Timex Essex Ave Thin 40mm Silver-tone Case SST TW2U42500,2746116540,Rp 1.199.400
Jam Tangan Timex Navi XL Automatic 41mm Leather Strap Watch TW2U10000,2746074252,Rp 2.069.550
Jam Tangan Olivia Burton Secret Garden Mini Dial RG Boucle OB16FS105,2698693824,Rp 2.475.000
Daniel Wellington Classic Petite St. Mawes Black 32mm Rose Gold,2174727862,Rp 2.850.000
Daniel Wellington Classic Petite Ashfield Black Rose Gold 28mm,2156661525,Rp 2.700.000
Daniel Wellington Strap Nato Cornwall Rose Gold - 04.MCNS.0017,2148592432,Rp 560.000
Daniel Wellington Quadro 20X26 Pressed Sterling S White - DW00100438,2028519317,Rp 3.270.000
Jam Tangan Wanita Mini White Wonderland Silver & Rose Gold Bracelet,1517281119,Rp 2.250.000
Daniel Wellington Classic Petite Ashfield Black Rose Gold 32mm,1030327838,Rp 3.130.000
Anting Olivia Burton Bejewelled Bee Earrings OBJAME115,616056119,Rp 588.750
Jam Tangan Olivia Burton Queen Bee Black MOP Rose Gold Mesh OB16AM145,543064026,Rp 3.700.000
Jam Tangan Olivia Burton Midi Silver Gold Clear Crystals OB16WD107,3598554161,Rp 2.775.000
Jam Tangan Olivia Burton Mini White MOP Sparkle Markers Silver Boucle,2348760154,Rp 2.475.000
Daniel Wellington Classic Petite Cornwall Black Rose Gold 28mm,2156519850,Rp 2.130.000
Jam Tangan Pria D1 Milano Polycarbon 2019 Black with IP Gun Bezel,617208079,Rp 2.295.000
Jam Tangan Timex Men's Briarwood 40mm Silvertone Expansion TW2T46100,6381762246,Rp 779.400
Jam Tangan Olivia Burton Mini Rose Gold MOP Sparkle Markers OB16MN10,3598463463,Rp 3.000.000
Jam Tangan Timex Fairfield Supernova Chronograph TW2R97700,2779017436,Rp 1.169.550
Jam Tangan Olivia Burton Gunmetal Glitter Demi Dial & Mesh OB16GD49,2368072744,Rp 2.475.000
Daniel Wellington Classic Black Sheffield 40mm Rose Gold 04.WCBLW.0007,2233847775,Rp 3.990.000
Jam Tangan Daniel Wellington Classic St. Mawes 40mm Rose Gold,2221348829,Rp 3.990.000
Daniel Wellington Classic Black Cornwall 40mm Rose Gold 04.MCBNW.0001,2148816294,Rp 3.270.000
Daniel Wellington Classic Petite Sterling 28mm 04.CPMW28.0002,2045186166,Rp 2.700.000
Daniel Wellington Iconic Motion (10 ATM) 40 Silver Black DW00100436,2030861786,Rp 4.280.000
Anting Olivia Burton Bejewelled Bee Earrings OBJAME106,616055375,Rp 588.750
Jam Tangan Pria Timex Waterbury Classic Chrono 40mm TW2T71500 Original,612369838,Rp 1.559.400
Jam Tangan Wanita Olivia Burton 3D Bee Midi Grey Dial Rose Gold Mesh,523076328,Rp 3.700.000
Jam Tangan Timex Mens Waterbury Ocean Dark Blue with Dark Blue Dial,6382887544,Rp 1.259.400
Jam Tangan Timex Expedition Full-Size CAT Black Case TW4B20400,4749105372,Rp 539.550
Jam Tangan Olivia Burton Midi Honey Bee Dusty Pink & Silver OB16FB25,3598150702,Rp 2.475.000
